<xs:schema attributeFormDefault="unqualified" elementFormDefault="qualified" xmlns:xs="http://www.w3.org/2001/XMLSchema">
  <xs:element name="searchConfig">
    <xs:complexType>
      <xs:sequence>
        <xs:element name="searchMeta" maxOccurs="unbounded" minOccurs="0">
          <xs:complexType>
            <xs:sequence>
              <xs:element type="xs:string" name="sql-query"/>
              <xs:element name="result-object">
                <xs:complexType>
                  <xs:sequence>
                    <xs:element name="field" maxOccurs="unbounded" minOccurs="0">
                      <xs:complexType>
                        <xs:simpleContent>
                          <xs:extension base="xs:string">
                            <xs:attribute type="xs:int" name="index"/>
                            <xs:attribute type="xs:string" name="fieldName"/>
                          </xs:extension>
                        </xs:simpleContent>
                      </xs:complexType>
                    </xs:element>
                  </xs:sequence>
                  <xs:attribute type="xs:string" name="className"/>
                </xs:complexType>
              </xs:element>
              <xs:element name="searchableField" maxOccurs="unbounded" minOccurs="0">
                <xs:complexType>
                  <xs:sequence>
                    <xs:element type="xs:string" name="operator" maxOccurs="unbounded" minOccurs="0"/>
                  </xs:sequence>
                  <xs:attribute type="xs:string" name="fieldName"/>
                  <xs:attribute type="xs:string" name="tableAlias"/>
                  <xs:attribute type="xs:string" name="dataType"/>
                </xs:complexType>
              </xs:element>
              <xs:element name="sortableField" maxOccurs="unbounded" minOccurs="0">
                <xs:complexType>
                  <xs:simpleContent>
                    <xs:extension base="xs:string">
                      <xs:attribute type="xs:string" name="fieldName"/>
                      <xs:attribute type="xs:string" name="tableAlias"/>
                    </xs:extension>
                  </xs:simpleContent>
                </xs:complexType>
              </xs:element>
            </xs:sequence>
            <xs:attribute type="xs:string" name="resourceName"/>
          </xs:complexType>
        </xs:element>
      </xs:sequence>
    </xs:complexType>
  </xs:element>
</xs:schema>